{
  "format_version": "1.0",
  "id": "unsolvedmath-1293",
  "source_registry": "unsolvedmath-1.1.0",
  "title": "Dickson's Conjecture",
  "statement": {
    "representation": "markdown-latex",
    "text": "Do finitely many linear forms simultaneously take prime values infinitely often, barring congruence obstructions?",
    "sha256": "0507a6b9a850ecce34c8062d0e9aa1f96e1a5119ff657d0db65b07e26bee348d",
    "contains_placeholder": false,
    "quality_flags": []
  },
  "status_observation": {
    "state": "open",
    "as_of": "2026-05-13T15:00:25.000Z",
    "evidence": "commit-pinned UnsolvedMath 1.1.0 secondary aggregation"
  },
  "provenance": {
    "source_url": "https://huggingface.co/datasets/ulamai/UnsolvedMath/resolve/5f80c88c8b3be1c24ae143e0112908ac4010db84/problems.json",
    "context_url": "https://www.unsolvedmath.com/problems/NT-085",
    "source_locator": "dataset ID 1293; problem number NT-085",
    "source_commit": "5f80c88c8b3be1c24ae143e0112908ac4010db84",
    "source_sha256": "3dadd69ec9d0dbc8161fedd6231fa74e2296ca7da60767a0b23fb5b6b8b5deee",
    "source_tag": "1.1.0",
    "tags": [
      "category:number-theory",
      "difficulty:L5",
      "secondary-aggregation"
    ]
  },
  "review_flags": [
    "primary-source-provenance",
    "exact-statement-and-polarity",
    "current-status"
  ]
}
