{
  "format_version": "1.0",
  "id": "fc-bench-v1-0751",
  "source_registry": "formal-conjectures-bench-v1",
  "title": "homogeneousSpace_exists_surjective",
  "statement": {
    "representation": "lean4-declaration",
    "text": "@[category research open, AMS 54]\ntheorem homogeneousSpace_exists_surjective :\n    answer(sorry) ↔ ∀ (X : Type) (_ : TopologicalSpace X), CompactSpace X →\n      ∃ (Y : Type) (_ : TopologicalSpace Y), CompactSpace Y ∧ HomogeneousSpace Y ∧\n        ∃ f : Y → X, Continuous f ∧ f.Surjective",
    "language_version": "Lean 4.27.0",
    "sha256": "b51d862d3dd0709bec2ee1adb5ed9458c74284f804b75339d81a3712f108510f",
    "contains_placeholder": true
  },
  "status_observation": {
    "state": "research open",
    "as_of": null,
    "evidence": "pinned Formal Conjectures benchmark tag"
  },
  "provenance": {
    "source_url": "https://github.com/google-deepmind/formal-conjectures/blob/7a41db3d761324599812d6ca6cb6a9f311046dc7/FormalConjectures/Paper/Homogenous.lean#L65",
    "source_locator": "FormalConjectures/Paper/Homogenous.lean:65#homogeneousSpace_exists_surjective",
    "source_commit": "7a41db3d761324599812d6ca6cb6a9f311046dc7",
    "source_tag": "bench-v1-lean4.27.0",
    "tags": [
      "Paper",
      "AMS-54"
    ]
  },
  "review_flags": [
    "statement-and-polarity",
    "status"
  ]
}
