{
  "format_version": "1.0",
  "id": "erdos-0458",
  "source_registry": "erdos-problems",
  "title": "Erdős problem #458",
  "statement": {
    "representation": "source-reference",
    "text": null,
    "contains_placeholder": false
  },
  "status_observation": {
    "state": "open",
    "as_of": "2025-08-31",
    "evidence": "pinned Erdős Problems maintainer feed"
  },
  "provenance": {
    "source_url": "https://www.erdosproblems.com/458",
    "source_locator": "Erdős problem 458",
    "source_commit": "1fddae4643fac0308db2e557876b78072e30f2e1",
    "tags": [
      "number theory",
      "primes"
    ]
  },
  "related_conjecture_ids": [
    "cb-0122"
  ]
}
