{
  "format_version": "1.0",
  "id": "unsolvedmath-3178",
  "source_registry": "unsolvedmath-1.1.0",
  "title": "Hamilton decomposition of prisms over 3-connected cubic planar graphs",
  "statement": {
    "representation": "markdown-latex",
    "text": "Conjecture Every prism over a $3$-connected cubic planar graph can be decomposed into two Hamilton cycles.",
    "sha256": "913f5a0389b7a51659b51671e6e99a20b1d50082305af0735fd45195e070dca4",
    "contains_placeholder": false,
    "quality_flags": []
  },
  "status_observation": {
    "state": "open",
    "as_of": "2026-05-13T15:00:25.000Z",
    "evidence": "commit-pinned UnsolvedMath 1.1.0 secondary aggregation"
  },
  "provenance": {
    "source_url": "https://huggingface.co/datasets/ulamai/UnsolvedMath/resolve/5f80c88c8b3be1c24ae143e0112908ac4010db84/problems.json",
    "context_url": "https://www.unsolvedmath.com/problems/OPG-47356",
    "source_locator": "dataset ID 3178; problem number OPG-47356",
    "source_commit": "5f80c88c8b3be1c24ae143e0112908ac4010db84",
    "source_sha256": "3dadd69ec9d0dbc8161fedd6231fa74e2296ca7da60767a0b23fb5b6b8b5deee",
    "source_tag": "1.1.0",
    "tags": [
      "category:graph-theory",
      "difficulty:L1",
      "secondary-aggregation",
      "set:opengarden"
    ]
  },
  "review_flags": [
    "primary-source-provenance",
    "exact-statement-and-polarity",
    "current-status"
  ]
}
