{
  "format_version": "1.0",
  "id": "kourovka-main-14-010",
  "source_registry": "kourovka-notebook-21",
  "title": "Kourovka problem 14.10 (main)",
  "statement": {
    "representation": "pdf-text-entry",
    "text": "c) Find an explicit and “natural” finitely presented group Γn and an embed-\nding of GLn (Q) in Γn .\n   Another phrasing of the same problems is: find a simplicial complex X which\ncovers a finite complex such that the fundamental group of X is Q or, respectively,\nGLn (Q).                                                             P. de la Harpe",
    "sha256": "0c846575be16c586ab12fa53b5cda23f533242f8aeb02c859b7cde32233c6cb2",
    "contains_placeholder": false,
    "unmapped_control_count": 0
  },
  "status_observation": {
    "state": "listed-unsolved",
    "as_of": "2026-07-03",
    "evidence": "pinned 21st Kourovka Notebook edition"
  },
  "provenance": {
    "source_url": "https://kourovkanotebookorg.wordpress.com/wp-content/uploads/2026/07/21tkt.pdf#page=72",
    "source_locator": "Kourovka 14.10, main section, page 72",
    "source_sha256": "301b0cdcc53abc88b57cc0732cad73bf8fbe1c9ba0de5a0a794070398e3395fe",
    "tags": [
      "group-theory",
      "kourovka-main"
    ]
  },
  "review_flags": [
    "exact-statement-and-polarity",
    "current-status"
  ]
}
