{
  "format_version": "1.0",
  "id": "unsolvedmath-0086",
  "source_registry": "unsolvedmath-1.1.0",
  "title": "Hilbert's 9th Problem: Reciprocity Laws",
  "statement": {
    "representation": "markdown-latex",
    "text": "Generalize the reciprocity law of number theory to arbitrary number fields.",
    "sha256": "bcc099535758a2b945378f417e5bbe209dfca5c5a27ac63156c8030a37b18ee1",
    "contains_placeholder": false,
    "quality_flags": []
  },
  "status_observation": {
    "state": "open",
    "as_of": "2026-05-13T15:00:25.000Z",
    "evidence": "commit-pinned UnsolvedMath 1.1.0 secondary aggregation"
  },
  "provenance": {
    "source_url": "https://huggingface.co/datasets/ulamai/UnsolvedMath/resolve/5f80c88c8b3be1c24ae143e0112908ac4010db84/problems.json",
    "context_url": "https://www.unsolvedmath.com/problems/HIL-009",
    "source_locator": "dataset ID 86; problem number HIL-009",
    "source_commit": "5f80c88c8b3be1c24ae143e0112908ac4010db84",
    "source_sha256": "3dadd69ec9d0dbc8161fedd6231fa74e2296ca7da60767a0b23fb5b6b8b5deee",
    "source_tag": "1.1.0",
    "tags": [
      "category:number-theory",
      "difficulty:L5",
      "secondary-aggregation",
      "set:hilbert-problems"
    ]
  },
  "review_flags": [
    "primary-source-provenance",
    "exact-statement-and-polarity",
    "current-status"
  ]
}
