{
  "format_version": "1.0",
  "id": "kourovka-main-18-006",
  "source_registry": "kourovka-notebook-21",
  "title": "Kourovka problem 18.6 (main)",
  "statement": {
    "representation": "pdf-text-entry",
    "text": "Is every finitely generated one-relator group residually amenable?\n                                                                       G. N. Arzhantseva",
    "sha256": "87e606dbdd123735a46d88a32938710d44eef6f19db70e3c9d8fcc5bd34ce874",
    "contains_placeholder": false,
    "unmapped_control_count": 0
  },
  "status_observation": {
    "state": "listed-unsolved",
    "as_of": "2026-07-03",
    "evidence": "pinned 21st Kourovka Notebook edition"
  },
  "provenance": {
    "source_url": "https://kourovkanotebookorg.wordpress.com/wp-content/uploads/2026/07/21tkt.pdf#page=116",
    "source_locator": "Kourovka 18.6, main section, page 116",
    "source_sha256": "301b0cdcc53abc88b57cc0732cad73bf8fbe1c9ba0de5a0a794070398e3395fe",
    "tags": [
      "group-theory",
      "kourovka-main"
    ]
  },
  "review_flags": [
    "exact-statement-and-polarity",
    "current-status"
  ]
}
