{
  "format_version": "1.0",
  "id": "fc-bench-v1-0330",
  "source_registry": "formal-conjectures-bench-v1",
  "title": "erdos_409.variants.sigma_termination",
  "statement": {
    "representation": "lean4-declaration",
    "text": "@[category research open, AMS 11]\ntheorem erdos_409.variants.sigma_termination (n : ℕ) (hn : n > 1) :\n    ∃ i, (σ 1 · - 1)^[i] n |>.Prime",
    "language_version": "Lean 4.27.0",
    "sha256": "3f84ec24acf72506778ff4ece2ab447b1e0a2d77b8007b6de77a65a10656dc32",
    "contains_placeholder": false
  },
  "status_observation": {
    "state": "research open",
    "as_of": null,
    "evidence": "pinned Formal Conjectures benchmark tag"
  },
  "provenance": {
    "source_url": "https://github.com/google-deepmind/formal-conjectures/blob/7a41db3d761324599812d6ca6cb6a9f311046dc7/FormalConjectures/ErdosProblems/409.lean#L114",
    "source_locator": "FormalConjectures/ErdosProblems/409.lean:114#erdos_409.variants.sigma_termination",
    "source_commit": "7a41db3d761324599812d6ca6cb6a9f311046dc7",
    "source_tag": "bench-v1-lean4.27.0",
    "tags": [
      "ErdosProblems",
      "AMS-11"
    ]
  },
  "review_flags": [
    "statement-and-polarity",
    "status"
  ]
}
