{
  "format_version": "1.0",
  "id": "unsolvedmath-1956",
  "source_registry": "unsolvedmath-1.1.0",
  "title": "Erdős Problem #146",
  "statement": {
    "representation": "markdown-latex",
    "text": "If $H$ is bipartite and is $r$-degenerate, that is, every induced subgraph of $H$ has minimum degree $\\leq r$, then $ \\mathrm{ex}(n;H) \\ll n^{2-1/r}. $ ",
    "sha256": "6b95547dc9a094b25faa4ad17785774eab88f68c18316cb8596751aab9ec069c",
    "contains_placeholder": false,
    "quality_flags": []
  },
  "status_observation": {
    "state": "open",
    "as_of": "2026-05-13T15:00:25.000Z",
    "evidence": "commit-pinned UnsolvedMath 1.1.0 secondary aggregation"
  },
  "provenance": {
    "source_url": "https://huggingface.co/datasets/ulamai/UnsolvedMath/resolve/5f80c88c8b3be1c24ae143e0112908ac4010db84/problems.json",
    "context_url": "https://www.unsolvedmath.com/problems/EP-146",
    "source_locator": "dataset ID 1956; problem number EP-146",
    "source_commit": "5f80c88c8b3be1c24ae143e0112908ac4010db84",
    "source_sha256": "3dadd69ec9d0dbc8161fedd6231fa74e2296ca7da60767a0b23fb5b6b8b5deee",
    "source_tag": "1.1.0",
    "tags": [
      "background-embedded-json-fragment",
      "background-latex-citation-markup",
      "category:number-theory",
      "difficulty:L1",
      "secondary-aggregation",
      "set:erdos-problems"
    ]
  },
  "review_flags": [
    "primary-source-provenance",
    "exact-statement-and-polarity",
    "current-status"
  ]
}
