{
  "format_version": "1.0",
  "id": "unsolvedmath-1338",
  "source_registry": "unsolvedmath-1.1.0",
  "title": "MLC Conjecture",
  "statement": {
    "representation": "markdown-latex",
    "text": "Is the Mandelbrot set locally connected?",
    "sha256": "d7de5656ec11fa244776ec890c6736bfcd3eecfef15cdc183d5d483e9e0063d1",
    "contains_placeholder": false,
    "quality_flags": []
  },
  "status_observation": {
    "state": "open",
    "as_of": "2026-05-13T15:00:25.000Z",
    "evidence": "commit-pinned UnsolvedMath 1.1.0 secondary aggregation"
  },
  "provenance": {
    "source_url": "https://huggingface.co/datasets/ulamai/UnsolvedMath/resolve/5f80c88c8b3be1c24ae143e0112908ac4010db84/problems.json",
    "context_url": "https://www.unsolvedmath.com/problems/DYN-002",
    "source_locator": "dataset ID 1338; problem number DYN-002",
    "source_commit": "5f80c88c8b3be1c24ae143e0112908ac4010db84",
    "source_sha256": "3dadd69ec9d0dbc8161fedd6231fa74e2296ca7da60767a0b23fb5b6b8b5deee",
    "source_tag": "1.1.0",
    "tags": [
      "category:pde",
      "difficulty:L5",
      "problem-number-collision",
      "secondary-aggregation"
    ]
  },
  "review_flags": [
    "primary-source-provenance",
    "exact-statement-and-polarity",
    "current-status"
  ]
}
