{
  "format_version": "1.0",
  "id": "kourovka-main-19-070",
  "source_registry": "kourovka-notebook-21",
  "title": "Kourovka problem 19.70 (main)",
  "statement": {
    "representation": "pdf-text-entry",
    "text": "(P. Wesolek and P.-E. Caprace). Let S denote the class of nondiscrete com-\npactly generated, topologically simple tdlc groups. Let G be a non-elementary tdlcsc\ngroup. Is there a compactly generated closed subgroup H ⩽ G such that H has a\ncontinuous quotient in S ?                                                  C. Reid",
    "sha256": "990101de93be469258c144c976f63fcd4a004a6d062bfbcc0e49422842f89eab",
    "contains_placeholder": false,
    "unmapped_control_count": 0
  },
  "status_observation": {
    "state": "listed-unsolved",
    "as_of": "2026-07-03",
    "evidence": "pinned 21st Kourovka Notebook edition"
  },
  "provenance": {
    "source_url": "https://kourovkanotebookorg.wordpress.com/wp-content/uploads/2026/07/21tkt.pdf#page=139",
    "source_locator": "Kourovka 19.70, main section, page 139",
    "source_sha256": "301b0cdcc53abc88b57cc0732cad73bf8fbe1c9ba0de5a0a794070398e3395fe",
    "tags": [
      "group-theory",
      "kourovka-main"
    ]
  },
  "review_flags": [
    "exact-statement-and-polarity",
    "current-status"
  ]
}
