{
  "format_version": "1.0",
  "id": "unsolvedmath-2325",
  "source_registry": "unsolvedmath-1.1.0",
  "title": "Erdős Problem #826",
  "statement": {
    "representation": "markdown-latex",
    "text": "Are there infinitely many $n$ such that, for all $k\\geq 1$, $ \\tau(n+k)\\ll k? $ ",
    "sha256": "2a4f23474255036703b6c0ac50a0aeb80ac6ef065e07f5ebb25ed593c262133a",
    "contains_placeholder": false,
    "quality_flags": []
  },
  "status_observation": {
    "state": "open",
    "as_of": "2026-05-13T15:00:25.000Z",
    "evidence": "commit-pinned UnsolvedMath 1.1.0 secondary aggregation"
  },
  "provenance": {
    "source_url": "https://huggingface.co/datasets/ulamai/UnsolvedMath/resolve/5f80c88c8b3be1c24ae143e0112908ac4010db84/problems.json",
    "context_url": "https://www.unsolvedmath.com/problems/EP-826",
    "source_locator": "dataset ID 2325; problem number EP-826",
    "source_commit": "5f80c88c8b3be1c24ae143e0112908ac4010db84",
    "source_sha256": "3dadd69ec9d0dbc8161fedd6231fa74e2296ca7da60767a0b23fb5b6b8b5deee",
    "source_tag": "1.1.0",
    "tags": [
      "background-embedded-json-fragment",
      "category:combinatorics",
      "difficulty:L1",
      "secondary-aggregation",
      "set:erdos-problems"
    ]
  },
  "review_flags": [
    "primary-source-provenance",
    "exact-statement-and-polarity",
    "current-status"
  ]
}
