{
  "format_version": "1.0",
  "id": "fc-bench-v1-1001",
  "source_registry": "formal-conjectures-bench-v1",
  "title": "pi_pow_pi_pow_pi_pow_pi_transcendental",
  "statement": {
    "representation": "lean4-declaration",
    "text": "@[category research open, AMS 11 33]\ntheorem pi_pow_pi_pow_pi_pow_pi_transcendental : Transcendental ℚ (π ^ (π ^ (π ^ π)))",
    "language_version": "Lean 4.27.0",
    "sha256": "f5e389fa920399d08b8d41f78382961039cad9bcbb4b9b0a1aa8729e32380788",
    "contains_placeholder": false
  },
  "status_observation": {
    "state": "research open",
    "as_of": null,
    "evidence": "pinned Formal Conjectures benchmark tag"
  },
  "provenance": {
    "source_url": "https://github.com/google-deepmind/formal-conjectures/blob/7a41db3d761324599812d6ca6cb6a9f311046dc7/FormalConjectures/Wikipedia/Transcendental.lean#L88",
    "source_locator": "FormalConjectures/Wikipedia/Transcendental.lean:88#pi_pow_pi_pow_pi_pow_pi_transcendental",
    "source_commit": "7a41db3d761324599812d6ca6cb6a9f311046dc7",
    "source_tag": "bench-v1-lean4.27.0",
    "tags": [
      "Wikipedia",
      "AMS-11",
      "AMS-33"
    ]
  },
  "review_flags": [
    "statement-and-polarity",
    "status"
  ]
}
