{
  "format_version": "1.0",
  "id": "unsolvedmath-2846",
  "source_registry": "unsolvedmath-1.1.0",
  "title": "Kirby Problem 3.48",
  "statement": {
    "representation": "markdown-latex",
    "text": "(L-space Conjecture). For prime rational homology 3-spheres Y, are the following equivalent?\n\n(a) $\\pi_1(Y)$ is left-orderable.\n\n(b) Y is not an L-space.\n\n(c) Y admits a coorientable taut foliation.",
    "sha256": "664100acdf064d9823d28e62eacc76acb4552d76f64be3e3a2a3280793db4308",
    "contains_placeholder": false,
    "quality_flags": []
  },
  "status_observation": {
    "state": "open",
    "as_of": "2026-05-13T15:00:25.000Z",
    "evidence": "commit-pinned UnsolvedMath 1.1.0 secondary aggregation"
  },
  "provenance": {
    "source_url": "https://huggingface.co/datasets/ulamai/UnsolvedMath/resolve/5f80c88c8b3be1c24ae143e0112908ac4010db84/problems.json",
    "context_url": "https://www.unsolvedmath.com/problems/KP-3.48",
    "source_locator": "dataset ID 2846; problem number KP-3.48",
    "source_commit": "5f80c88c8b3be1c24ae143e0112908ac4010db84",
    "source_sha256": "3dadd69ec9d0dbc8161fedd6231fa74e2296ca7da60767a0b23fb5b6b8b5deee",
    "source_tag": "1.1.0",
    "tags": [
      "category:topology",
      "difficulty:L3",
      "secondary-aggregation",
      "set:kirby-low-dimensional-topology"
    ]
  },
  "review_flags": [
    "primary-source-provenance",
    "exact-statement-and-polarity",
    "current-status"
  ]
}
